{
  "$schema": "./framework-coverage.schema.json",
  "title": "Framework Coverage Matrix",
  "description": "How current agent frameworks support patterns from this catalog. Coverage values: 'fully' = first-class documented support; 'limited' = partial support, requires recipe, or only via integrations; 'none' = pattern is not supported by the framework and would need to be built outside it; 'unknown' = not yet analysed. Patterns omitted from a framework's coverage map are 'unknown' by convention. This file is hand-curated and conservative: contributors should add cells only with citation and update last_analyzed when they touch a row.",
  "last_analysis_date": "2026-05-01",
  "coverage_values": {
    "fully": "First-class, documented support; the canonical way to do this in the framework.",
    "limited": "Partial support: requires a recipe, third-party integration, workaround, or is not idiomatic.",
    "none": "Explicitly not supported; would need to be built outside the framework.",
    "unknown": "Not yet analysed."
  },
  "frameworks": [
    {
      "id": "langchain",
      "name": "LangChain",
      "vendor": "LangChain Inc.",
      "language": "Python, TypeScript",
      "url": "https://www.langchain.com/",
      "last_analyzed": "2026-05-02",
      "coverage": {
        "tool-use": "fully",
        "react": "fully",
        "plan-and-execute": "fully",
        "structured-output": "fully",
        "agentic-rag": "fully",
        "hybrid-search": "fully",
        "contextual-retrieval": "limited",
        "cross-encoder-reranking": "fully",
        "fallback-chain": "fully",
        "step-budget": "fully",
        "session-isolation": "fully",
        "context-window-packing": "limited",
        "supervisor": "limited",
        "handoff": "limited",
        "approval-queue": "limited",
        "citation-streaming": "limited",
        "mcp": "fully",
        "skill-library": "limited",
        "chain-of-thought": "limited",
        "self-refine": "limited"
      }
    },
    {
      "id": "langgraph",
      "name": "LangGraph",
      "vendor": "LangChain Inc.",
      "language": "Python, TypeScript",
      "url": "https://langchain-ai.github.io/langgraph/",
      "last_analyzed": "2026-05-02",
      "coverage": {
        "tool-use": "fully",
        "react": "fully",
        "structured-output": "fully",
        "supervisor": "fully",
        "orchestrator-workers": "fully",
        "handoff": "fully",
        "subagent-isolation": "limited",
        "approval-queue": "fully",
        "step-budget": "fully",
        "agent-resumption": "fully",
        "decision-log": "fully",
        "agentic-rag": "fully",
        "fallback-chain": "fully",
        "mcp": "fully",
        "evaluator-optimizer": "fully",
        "session-isolation": "fully"
      }
    },
    {
      "id": "llamaindex",
      "name": "LlamaIndex",
      "vendor": "LlamaIndex Inc.",
      "language": "Python, TypeScript",
      "url": "https://www.llamaindex.ai/",
      "last_analyzed": "2026-05-02",
      "coverage": {
        "agentic-rag": "fully",
        "contextual-retrieval": "fully",
        "hybrid-search": "fully",
        "cross-encoder-reranking": "fully",
        "tool-use": "fully",
        "react": "fully",
        "structured-output": "fully",
        "agent-resumption": "limited",
        "mcp": "fully",
        "supervisor": "fully",
        "orchestrator-workers": "fully",
        "step-budget": "fully"
      }
    },
    {
      "id": "autogen",
      "name": "AutoGen",
      "vendor": "Microsoft",
      "language": "Python, .NET",
      "url": "https://microsoft.github.io/autogen/stable/",
      "last_analyzed": "2026-05-02",
      "coverage": {
        "autogen-conversational": "fully",
        "supervisor": "fully",
        "orchestrator-workers": "fully",
        "camel-role-playing": "limited",
        "tool-use": "fully",
        "code-as-action": "fully",
        "code-execution": "fully",
        "handoff": "fully",
        "event-driven-agent": "fully",
        "subagent-isolation": "limited",
        "agent-resumption": "limited",
        "step-budget": "fully",
        "structured-output": "fully"
      }
    },
    {
      "id": "crewai",
      "name": "CrewAI",
      "vendor": "CrewAI Inc.",
      "language": "Python",
      "url": "https://www.crewai.com/",
      "last_analyzed": "2026-05-02",
      "coverage": {
        "supervisor": "fully",
        "orchestrator-workers": "fully",
        "camel-role-playing": "limited",
        "tool-use": "fully",
        "handoff": "fully",
        "step-budget": "fully",
        "structured-output": "fully",
        "agentic-rag": "limited",
        "mcp": "fully"
      }
    },
    {
      "id": "dspy",
      "name": "DSPy",
      "vendor": "Stanford NLP",
      "language": "Python",
      "url": "https://dspy.ai/",
      "last_analyzed": "2026-05-02",
      "coverage": {
        "dspy-signatures": "fully",
        "structured-output": "fully",
        "chain-of-thought": "fully",
        "react": "fully",
        "best-of-n": "fully",
        "self-refine": "limited",
        "automatic-workflow-search": "fully",
        "tool-use": "fully",
        "evaluator-optimizer": "fully"
      }
    },
    {
      "id": "semantic-kernel",
      "name": "Semantic Kernel",
      "vendor": "Microsoft",
      "language": ".NET, Python, Java",
      "url": "https://learn.microsoft.com/en-us/semantic-kernel/",
      "last_analyzed": "2026-04-30",
      "coverage": {
        "tool-use": "fully",
        "skill-library": "fully",
        "structured-output": "limited",
        "react": "limited",
        "supervisor": "limited",
        "mcp": "fully",
        "agent-resumption": "limited"
      }
    },
    {
      "id": "haystack",
      "name": "Haystack",
      "vendor": "deepset",
      "language": "Python",
      "url": "https://haystack.deepset.ai/",
      "last_analyzed": "2026-04-30",
      "coverage": {
        "agentic-rag": "fully",
        "hybrid-search": "fully",
        "cross-encoder-reranking": "fully",
        "citation-streaming": "fully",
        "structured-output": "limited",
        "tool-use": "limited",
        "react": "limited",
        "step-budget": "limited"
      }
    },
    {
      "id": "smolagents",
      "name": "smolagents",
      "vendor": "Hugging Face",
      "language": "Python",
      "url": "https://huggingface.co/docs/smolagents/",
      "last_analyzed": "2026-04-30",
      "coverage": {
        "code-as-action": "fully",
        "tool-use": "fully",
        "react": "fully",
        "subagent-isolation": "limited",
        "agent-as-tool-embedding": "fully",
        "structured-output": "limited",
        "step-budget": "fully"
      }
    },
    {
      "id": "openai-agents-sdk",
      "name": "OpenAI Agents SDK",
      "vendor": "OpenAI",
      "language": "Python, TypeScript",
      "url": "https://openai.github.io/openai-agents-python/",
      "last_analyzed": "2026-05-02",
      "coverage": {
        "tool-use": "fully",
        "handoff": "fully",
        "subagent-isolation": "limited",
        "structured-output": "fully",
        "agent-resumption": "fully",
        "step-budget": "fully",
        "mcp": "fully",
        "react": "fully",
        "supervisor": "fully"
      }
    },
    {
      "id": "openai-swarm",
      "name": "OpenAI Swarm",
      "vendor": "OpenAI",
      "language": "Python",
      "url": "https://github.com/openai/swarm",
      "status": "deprecated",
      "successor": "openai-agents-sdk",
      "last_analyzed": "2026-04-30",
      "coverage": {
        "handoff": "fully",
        "supervisor": "fully",
        "tool-use": "fully",
        "structured-output": "limited"
      }
    },
    {
      "id": "pydantic-ai",
      "name": "Pydantic AI",
      "vendor": "Pydantic Services Inc.",
      "language": "Python",
      "url": "https://ai.pydantic.dev/",
      "last_analyzed": "2026-04-30",
      "coverage": {
        "structured-output": "fully",
        "tool-use": "fully",
        "react": "fully",
        "step-budget": "fully",
        "agent-resumption": "limited",
        "mcp": "fully",
        "evaluator-optimizer": "limited"
      }
    },
    {
      "id": "n8n",
      "name": "n8n",
      "vendor": "n8n GmbH",
      "language": "TypeScript (low-code)",
      "url": "https://n8n.io/",
      "last_analyzed": "2026-04-30",
      "coverage": {
        "tool-use": "fully",
        "agentic-rag": "fully",
        "event-driven-agent": "fully",
        "scheduled-agent": "fully",
        "fallback-chain": "fully",
        "supervisor": "limited",
        "structured-output": "fully",
        "approval-queue": "fully",
        "mcp": "fully"
      }
    },
    {
      "id": "inngest-agentkit",
      "name": "Inngest AgentKit",
      "vendor": "Inngest",
      "language": "TypeScript",
      "url": "https://agentkit.inngest.com/",
      "last_analyzed": "2026-04-30",
      "coverage": {
        "agent-resumption": "fully",
        "event-driven-agent": "fully",
        "scheduled-agent": "fully",
        "step-budget": "fully",
        "tool-use": "fully",
        "supervisor": "fully",
        "approval-queue": "fully"
      }
    },
    {
      "id": "temporal",
      "name": "Temporal",
      "vendor": "Temporal Technologies",
      "language": "Go, Java, Python, TypeScript, .NET, PHP, Ruby",
      "url": "https://temporal.io/",
      "last_analyzed": "2026-05-02",
      "coverage": {
        "agent-resumption": "fully",
        "scheduled-agent": "fully",
        "event-driven-agent": "fully",
        "compensating-action": "fully",
        "step-budget": "fully"
      }
    },
    {
      "id": "mastra",
      "name": "Mastra",
      "vendor": "Mastra",
      "language": "TypeScript",
      "url": "https://mastra.ai/",
      "last_analyzed": "2026-04-30",
      "coverage": {
        "tool-use": "fully",
        "react": "fully",
        "agent-resumption": "limited",